{"id":"opt_matmul_boundary_masks_for_tail_tiles_v1","schema_version":"0.1.0","unit_type":"optimization_motif","status":"quarantine","abstraction_level":"backend_instance","task_phases":["performance_optimize","autotune"],"operator_scope":{"families":["matmul"]},"conditions":{"valid_when":["OpSpec and phase match this capsule."],"invalid_when":["OpSpec contradicts capsule scope or hidden tests fail."]},"action":{"kind":"recommend","instructions":["Consider boundary masks for tail tiles only after hidden correctness and repeated benchmark."]},"expected_effect":{"correctness":"Reduce semantic/API mistakes.","performance":"Only valid after correctness gates.","search_efficiency":"Reduce low-value search branches.","risk":"H20 performance remains unverified unless repository runs measure it."},"evidence":{"source_refs":["source:pytorch_matmul","claim:clm_pytorch_matmul_04"],"evidence_level":"claim","confidence":0.88},"validation":{"gates":["schema","static_legality","smoke_correctness","quick_correctness","hidden_correctness","anti_cheating"]},"failure_boundary":{"known_failures":["shape hardcoding","wrong dtype/layout assumption"],"boundary_tests":["odd/non-power-of-two shape","hidden dtype/layout sweep"],"do_not_apply":["outside declared OpSpec"]},"retrieval":{"keys":["opt_matmul_boundary_masks_for_tail_tiles_v1","matmul","performance_optimize","autotune"],"negative_keys":["cheat","hardcode","unverified_speedup"],"priority":55,"max_context_tokens":260},"lineage":{"created_by":"gpt-5.5-pro-h20-mvp-corpus-build","created_at":"2026-07-06T00:00:00Z","updated_at":"2026-07-06T00:00:00Z","parent_units":[],"supersedes":[],"audit_log_refs":["sources/derived_claims/kb_v0_lineage.yaml"]},"backend_instances":[{"vendor":"nvidia","backend":"nvidia-triton-cuda","device_class":"h20_runtime_detected","target_fingerprint":"runtime-detected H20; no in-repo measurement in KB v0","toolchain":{"triton":"current docs","pytorch":"2.12 docs","cuda":"13.3 docs"},"validity":"requires_revalidation","notes":"Public or neighbor evidence only; do not treat as H20 measurement."}]}
