{
  "id": "perf_layout_kbx_transpose_tile_copy_candidate_v1",
  "schema_version": "0.1.0",
  "unit_type": "optimization_motif",
  "status": "quarantine",
  "abstraction_level": "backend_abstract",
  "task_phases": ["performance_optimize", "autotune"],
  "operator_scope": {
    "families": ["layout_indexing", "layout", "indexing", "irregular_memory"],
    "op_names": ["*"],
    "semantic_signature": "candidate tiled schedule for KBX permute_copy or regular materialized layout transform after correctness passes",
    "shape_patterns": ["*"],
    "dtype_scope": ["fp16", "bf16", "fp32"],
    "layout_scope": ["*", "non_contiguous", "as_declared_by_task"]
  },
  "backend_abstract_features": {
    "execution_hierarchy": ["program", "warp-or-wave", "lane", "tile"],
    "memory_hierarchy": ["global", "cache", "shared_or_scratchpad", "register"],
    "synchronization": ["block_local_sync_if_shared_tile_used"],
    "profile_symptoms": ["memory_bound", "uncoalesced_memory", "bank_conflict", "occupancy_limited"]
  },
  "conditions": {
    "valid_when": ["Task is KBX permute_copy or a regular materialized transpose/permute/strided copy and a stride-correct candidate is hidden-correct.", "Profile summary indicates memory-bound or uncoalesced global-memory access."],
    "invalid_when": ["Task is view-only metadata transform.", "Dominant operation is arbitrary-index gather/scatter, masked_select compaction, or pointwise where rather than regular affine layout transform.", "Correctness for edge tiles and non-contiguous strides has not passed."],
    "preconditions": ["Apply sem_layout_kbx_stride_indexing_v1 before trying tiling."
    ]
  },
  "mechanism": "Regular layout transforms can use tile schedules to make one or both global-memory legs more coalesced, but shared-memory tiles can add bank conflicts, synchronization, and occupancy pressure.",
  "action": {
    "kind": "recommend",
    "instructions": ["Use a 2D or ND tile schedule that maps source and destination logical coordinates explicitly and keeps edge masks for partial tiles.", "Benchmark coalesced-read and coalesced-write variants when cheap; choose based on repeated p50/p95, not intuition.", "Consider a shared-memory tile only after direct stride-aware copy is correct and profile attributes the bottleneck to uncoalesced regular access.", "Do not call torch.permute, torch.transpose, contiguous(), reshape(), or clone() to perform the target copy in the submitted path."],
    "knob_space": {"tile_m": ["16", "32"], "tile_n": ["16", "32", "64"], "num_warps": ["4", "8"], "use_shared_tile": ["false_first", "true_candidate_if_profile_uncoalesced"]}
  },
  "expected_effect": {
    "correctness": "No effect if the stride semantic capsule is already followed.",
    "performance": "Candidate-only: may improve regular layout-copy coalescing; no H20 speedup is asserted.",
    "search_efficiency": "Bounds schedule search for KBX permute_copy after correctness.",
    "risk": "Wrong coordinate mapping, bank conflicts, or synchronization overhead can erase gains."
  },
  "evidence": {
    "source_refs": ["source:kbx_expanded_pilot_task_manifest", "source:cuda_best_practices_memory_coalescing", "source:pytorch_stride_contiguous_tensor_views", "claim:clm_kbx_layout_transpose_tile_copy_01"],
    "benchmark_refs": [],
    "profile_refs": [],
    "evidence_level": "claim",
    "confidence": 0.6
  },
  "validation": {
    "gates": ["hidden_correctness", "benchmark_repeat", "profile_attribution", "reproducibility"],
    "correctness_matrix": ["rectangular dimensions", "non-power-of-two edges", "non-contiguous source", "declared output layout", "small dimension less than tile size"],
    "performance_requirements": ["Compare direct stride-aware copy, coalesced-read tile, and coalesced-write tile under identical protocol before promotion."],
    "promotion_policy": "Requires H20 benchmark/profile evidence and preferably an ablation against direct copy."
  },
  "failure_boundary": {
    "known_failures": ["Tiling with conflated source/destination strides gives wrong coordinates.", "Partial tiles without masks can read/write out of bounds.", "Shared-memory tiles can introduce bank conflicts or reduce occupancy."],
    "boundary_tests": ["asymmetric permute", "rank greater than two", "strided source base offset", "edge tile"],
    "do_not_apply": ["index_select", "scatter", "masked_select", "expand_where", "fused_gather_masked_fill", "view-only metadata operation"]
  },
  "retrieval": {
    "keys": ["layout_indexing", "kbx", "permute_copy", "transpose_copy", "strided_copy", "layout_transform", "tile", "tiling", "coalesced", "uncoalesced", "shared_memory", "bank_conflict", "performance_optimize"],
    "negative_keys": ["gather", "scatter", "masked_select", "where", "view_only", "unverified_speedup"],
    "priority": 78,
    "max_context_tokens": 600
  },
  "lineage": {
    "created_by": "gpt-5.5-pro-h20-expanded-pilot-prep",
    "created_at": "2026-07-09T00:00:00Z",
    "updated_at": "2026-07-09T00:00:00Z",
    "parent_units": ["perf_layout_transpose_tile_copy_candidate_v1"],
    "supersedes": [],
    "audit_log_refs": ["sources/derived_claims/h20_expanded_pilot_claims.yaml"]
  }
}
