{"id":"val_layernorm_eps_inside_sqrt_v1","schema_version":"0.1.0","unit_type":"validation_policy","status":"quarantine","abstraction_level":"portable","task_phases":["correctness_repair","performance_optimize"],"operator_scope":{"families":["layernorm"]},"conditions":{"valid_when":["OpSpec and phase match this capsule."],"invalid_when":["OpSpec contradicts capsule scope or hidden tests fail."]},"action":{"kind":"validate","instructions":["Add validation focused on eps inside sqrt."]},"expected_effect":{"correctness":"Reduce semantic/API mistakes.","performance":"Only valid after correctness gates.","search_efficiency":"Reduce low-value search branches.","risk":"H20 performance remains unverified unless repository runs measure it."},"evidence":{"source_refs":["source:pytorch_native_layer_norm","claim:clm_pytorch_native_layer_norm_02"],"evidence_level":"claim","confidence":0.88},"validation":{"gates":["schema","static_legality","smoke_correctness","quick_correctness","hidden_correctness","anti_cheating"]},"failure_boundary":{"known_failures":["shape hardcoding","wrong dtype/layout assumption"],"boundary_tests":["odd/non-power-of-two shape","hidden dtype/layout sweep"],"do_not_apply":["outside declared OpSpec"]},"retrieval":{"keys":["val_layernorm_eps_inside_sqrt_v1","layernorm","correctness_repair","performance_optimize"],"negative_keys":["cheat","hardcode","unverified_speedup"],"priority":70,"max_context_tokens":260},"lineage":{"created_by":"gpt-5.5-pro-h20-mvp-corpus-build","created_at":"2026-07-06T00:00:00Z","updated_at":"2026-07-06T00:00:00Z","parent_units":[],"supersedes":[],"audit_log_refs":["sources/derived_claims/kb_v0_lineage.yaml"]}}
